"No.","Time","Source","Destination","Protocol","Length","Info"
"1","0.000000","Raspberr_6c:c9:25","Broadcast","ARP","60","Who has 192.168.0.45? Tell 192.168.0.41"
"2","0.163523","192.168.0.45","192.168.0.44","TCP","74","[TCP Port numbers reused] 6443  >  55148 [SYN, ACK] Seq=0 Ack=1 Win=65160 Len=0 MSS=1460 SACK_PERM=1 TSval=3872684788 TSecr=2177864021 WS=128"
"3","0.163785","192.168.0.42","192.168.0.44","UDP","103","7946  >  7946 Len=61"
"4","0.183688","192.168.0.44","192.168.0.45","TCP","54","55148  >  6443 [RST] Seq=1 Win=0 Len=0"
"5","0.184547","192.168.0.44","192.168.0.42","UDP","93","7946  >  7946 Len=51"
"6","0.206633","Raspberr_a8:2c:ee","Broadcast","ARP","60","Who has 192.168.0.45? Tell 192.168.0.42"
"7","0.213725","Raspberr_ab:80:26","Broadcast","ARP","60","Who has 192.168.0.45? Tell 192.168.0.39"
"8","0.231994","192.168.0.45","192.168.0.44","TCP","74","6443  >  55178 [SYN, ACK] Seq=0 Ack=1 Win=65160 Len=0 MSS=1460 SACK_PERM=1 TSval=3872684853 TSecr=2177865127 WS=128"
"9","0.232036","192.168.0.44","192.168.0.45","TCP","74","55374  >  6443 [SYN] Seq=0 Win=64240 Len=0 MSS=1460 SACK_PERM=1 TSval=2177918167 TSecr=0 WS=128"
"10","0.232062","192.168.0.44","192.168.0.45","TCP","74","55378  >  6443 [SYN] Seq=0 Win=64240 Len=0 MSS=1460 SACK_PERM=1 TSval=2177918167 TSecr=0 WS=128"
"11","0.252126","192.168.0.44","192.168.0.45","TCP","54","55178  >  6443 [RST] Seq=1 Win=0 Len=0"
"12","0.350616","192.168.0.45","192.168.0.44","TCP","74","6443  >  55182 [SYN, ACK] Seq=0 Ack=1 Win=65160 Len=0 MSS=1460 SACK_PERM=1 TSval=3872684980 TSecr=2177865127 WS=128"
"13","0.370763","192.168.0.44","192.168.0.45","TCP","54","55182  >  6443 [RST] Seq=1 Win=0 Len=0"
"14","0.459490","192.168.0.45","192.168.0.44","TCP","74","6443  >  55112 [SYN, ACK] Seq=0 Ack=1 Win=65160 Len=0 MSS=1460 SACK_PERM=1 TSval=3872685076 TSecr=2177858135 WS=128"
"15","0.479643","192.168.0.44","192.168.0.45","TCP","54","55112  >  6443 [RST] Seq=1 Win=0 Len=0"
"16","0.524912","Raspberr_15:08:e7","Broadcast","ARP","60","Gratuitous ARP for 192.168.0.242 (Request)"
"17","0.569656","Raspberr_83:fc:31","Broadcast","ARP","60","Who has 192.168.0.45? Tell 192.168.0.43"
"18","0.632830","Raspberr_ea:11:2e","Broadcast","ARP","60","Gratuitous ARP for 192.168.0.230 (Request)"
"19","0.632864","Raspberr_ea:11:2e","Broadcast","ARP","60","Gratuitous ARP for 192.168.0.230 (Reply)"
"20","0.655677","192.168.0.41","192.168.0.44","UDP","103","7946  >  7946 Len=61"
"21","0.668131","192.168.0.45","192.168.0.44","TCP","74","6443  >  55509 [SYN, ACK] Seq=0 Ack=1 Win=65160 Len=0 MSS=1460 SACK_PERM=1 TSval=3872685395 TSecr=2709711559 WS=128"
"22","0.676486","192.168.0.44","192.168.0.41","UDP","93","7946  >  7946 Len=51"
"23","0.687860","192.168.0.40","192.168.0.44","UDP","103","7946  >  7946 Len=61"
"24","0.688292","192.168.0.44","192.168.0.45","TCP","54","55509  >  6443 [RST] Seq=1 Win=0 Len=0"
"25","0.703187","192.168.0.44","192.168.0.45","TCP","74","55394  >  6443 [SYN] Seq=0 Win=64240 Len=0 MSS=1460 SACK_PERM=1 TSval=2177918638 TSecr=0 WS=128"
"26","0.708634","192.168.0.44","192.168.0.40","UDP","93","7946  >  7946 Len=51"
"27","0.821174","192.168.0.44","192.168.0.42","UDP","103","7946  >  7946 Len=61"
"28","0.863118","192.168.0.42","192.168.0.44","UDP","93","7946  >  7946 Len=51"
"29","1.015972","Raspberr_c2:f4:69","Broadcast","ARP","60","Who has 192.168.0.45? Tell 192.168.0.40"
"30","1.129968","Raspberr_ab:80:26","Broadcast","ARP","60","Who has 192.168.0.45? Tell 192.168.0.39"
"31","1.198160","192.168.0.45","192.168.0.44","TCP","74","6443  >  55172 [SYN, ACK] Seq=0 Ack=1 Win=65160 Len=0 MSS=1460 SACK_PERM=1 TSval=3872685880 TSecr=2177865126 WS=128"
"32","1.198553","Raspberr_a8:2c:ee","Broadcast","ARP","60","Who has 192.168.0.45? Tell 192.168.0.42"
"33","1.218315","192.168.0.44","192.168.0.45","TCP","54","55172  >  6443 [RST] Seq=1 Win=0 Len=0"
"34","1.224013","192.168.0.44","192.168.0.45","TCP","74","7946  >  48404 [SYN, ACK] Seq=0 Ack=1 Win=65160 Len=0 MSS=1460 SACK_PERM=1 TSval=2177919159 TSecr=3872668116 WS=128"
"35","1.337941","192.168.0.45","192.168.0.44","TCP","74","[TCP Port numbers reused] 6443  >  55152 [SYN, ACK] Seq=0 Ack=1 Win=65160 Len=0 MSS=1460 SACK_PERM=1 TSval=3872685982 TSecr=2177867159 WS=128"
"36","1.358081","192.168.0.44","192.168.0.45","TCP","54","55152  >  6443 [RST] Seq=1 Win=0 Len=0"
"37","1.480094","192.168.0.44","192.168.0.45","TCP","74","55366  >  6443 [SYN] Seq=0 Win=64240 Len=0 MSS=1460 SACK_PERM=1 TSval=2177919415 TSecr=0 WS=128"
"38","1.528676","Raspberr_15:08:e7","Broadcast","ARP","60","Gratuitous ARP for 192.168.0.242 (Request)"
"39","1.529159","Raspberr_15:08:e7","Broadcast","ARP","60","Gratuitous ARP for 192.168.0.242 (Reply)"
"40","1.529402","Raspberr_15:08:e7","Broadcast","ARP","60","Gratuitous ARP for 192.168.0.240 (Request)"
"41","1.532412","Raspberr_15:08:e7","Broadcast","ARP","60","Gratuitous ARP for 192.168.0.240 (Reply)"
"42","1.668275","192.168.0.45","192.168.0.44","TCP","74","[TCP Port numbers reused] 6443  >  55144 [SYN, ACK] Seq=0 Ack=1 Win=65160 Len=0 MSS=1460 SACK_PERM=1 TSval=3872686360 TSecr=2177866391 WS=128"
"43","1.684201","192.168.0.45","192.168.0.44","TCP","74","6443  >  54794 [SYN, ACK] Seq=0 Ack=1 Win=65160 Len=0 MSS=1460 SACK_PERM=1 TSval=3872686360 TSecr=2177852343 WS=128"
"44","1.684582","192.168.0.37","192.168.0.44","UDP","139","47621  >  8472 Len=97"
"45","1.688480","192.168.0.44","192.168.0.45","TCP","54","55144  >  6443 [RST] Seq=1 Win=0 Len=0"
"46","1.691883","Raspberr_83:fc:31","Broadcast","ARP","60","Who has 192.168.0.45? Tell 192.168.0.43"
"47","1.704114","192.168.0.44","192.168.0.45","TCP","74","[TCP Retransmission] [TCP Port numbers reused] 55394  >  6443 [SYN] Seq=0 Win=64240 Len=0 MSS=1460 SACK_PERM=1 TSval=2177919639 TSecr=0 WS=128"
"48","1.704357","192.168.0.44","192.168.0.45","TCP","66","54794  >  6443 [ACK] Seq=240 Ack=1 Win=502 Len=0 TSval=2177919639 TSecr=3872671059"
"49","1.705012","192.168.0.44","192.168.0.37","UDP","116","59444  >  8472 Len=74"
"50","1.705357","192.168.0.44","192.168.0.37","UDP","139","59444  >  8472 Len=97"
"51","1.731895","Raspberr_ea:11:2e","Broadcast","ARP","60","Gratuitous ARP for 192.168.0.230 (Request)"
"52","1.731938","Raspberr_ea:11:2e","Broadcast","ARP","60","Gratuitous ARP for 192.168.0.230 (Reply)"
"53","1.739465","192.168.0.37","192.168.0.44","UDP","116","47621  >  8472 Len=74"
"54","1.822679","192.168.0.44","192.168.0.39","UDP","103","7946  >  7946 Len=61"
"55","1.839520","192.168.0.39","192.168.0.44","UDP","93","7946  >  7946 Len=51"
"56","1.896135","192.168.0.44","192.168.0.45","TCP","74","55386  >  6443 [SYN] Seq=0 Win=64240 Len=0 MSS=1460 SACK_PERM=1 TSval=2177919831 TSecr=0 WS=128"
"57","2.000699","Raspberr_c2:f4:69","Broadcast","ARP","60","Who has 192.168.0.45? Tell 192.168.0.40"
"58","2.056409","Raspberr_6c:c9:25","Broadcast","ARP","60","Who has 192.168.0.45? Tell 192.168.0.41"
"59","2.152898","192.168.0.43","192.168.0.44","UDP","103","7946  >  7946 Len=61"
"60","2.174441","192.168.0.44","192.168.0.43","UDP","93","7946  >  7946 Len=51"
"61","2.233737","Raspberr_a8:2c:ee","Broadcast","ARP","60","Who has 192.168.0.45? Tell 192.168.0.42"
"62","2.415128","192.168.0.3","224.0.0.251","MDNS","286","Standard query 0x0000 PTR lb._dns-sd._udp.local, ""QM"" question PTR _companion-link._tcp.local, ""QM"" question NS openthread.thread.home.arpa, ""QM"" question PTR _homekit._tcp.local, ""QM"" question PTR Noraâ\200\231s MacBook Pro._companion-link._tcp.local PTR Noraâ\200\231s iMac._companion-link._tcp.local PTR Nicolaiâ\200\231s MacBook Pro._companion-link._tcp.local OPT"
"63","2.415520","fe80::1045:b620:674f:26a0","ff02::fb","MDNS","306","Standard query 0x0000 PTR lb._dns-sd._udp.local, ""QM"" question PTR _companion-link._tcp.local, ""QM"" question NS openthread.thread.home.arpa, ""QM"" question PTR _homekit._tcp.local, ""QM"" question PTR Noraâ\200\231s MacBook Pro._companion-link._tcp.local PTR Noraâ\200\231s iMac._companion-link._tcp.local PTR Nicolaiâ\200\231s MacBook Pro._companion-link._tcp.local OPT"
"64","2.562715","Raspberr_6c:c9:25","Raspberr_ea:11:2e","ARP","60","Who has 192.168.0.44? Tell 192.168.0.41"
"65","2.582832","Raspberr_ea:11:2e","Raspberr_6c:c9:25","ARP","42","192.168.0.44 is at b8:27:eb:ea:11:2e"
"66","2.618956","Raspberr_83:fc:31","Broadcast","ARP","60","Who has 192.168.0.45? Tell 192.168.0.43"
"67","2.722391","192.168.0.44","192.168.0.45","TCP","74","47994  >  7946 [SYN] Seq=0 Win=64240 Len=0 MSS=1460 SACK_PERM=1 TSval=2177920657 TSecr=0 WS=128"
"68","2.821275","192.168.0.44","192.168.0.37","UDP","103","7946  >  7946 Len=61"
"69","2.832617","Raspberr_ea:11:2e","Broadcast","ARP","60","Gratuitous ARP for 192.168.0.230 (Request)"
"70","2.832646","Raspberr_ea:11:2e","Broadcast","ARP","60","Gratuitous ARP for 192.168.0.230 (Reply)"
"71","2.889135","192.168.0.37","192.168.0.44","UDP","93","7946  >  7946 Len=51"
"72","2.919682","192.168.0.44","192.168.0.45","TCP","74","55400  >  6443 [SYN] Seq=0 Win=64240 Len=0 MSS=1460 SACK_PERM=1 TSval=2177920854 TSecr=0 WS=128"
"73","2.954895","192.168.0.39","192.168.0.44","UDP","103","7946  >  7946 Len=61"
"74","2.976227","192.168.0.44","192.168.0.39","UDP","93","7946  >  7946 Len=51"
"75","3.015980","Raspberr_c2:f4:69","Broadcast","ARP","60","Who has 192.168.0.45? Tell 192.168.0.40"
"76","3.076102","Raspberr_6c:c9:25","Broadcast","ARP","60","Who has 192.168.0.45? Tell 192.168.0.41"
"77","3.250844","Raspberr_a8:2c:ee","Broadcast","ARP","60","Who has 192.168.0.45? Tell 192.168.0.42"
"78","3.272096","192.168.0.44","192.168.0.45","TCP","74","55370  >  6443 [SYN] Seq=0 Win=64240 Len=0 MSS=1460 SACK_PERM=1 TSval=2177921207 TSecr=0 WS=128"
"79","3.293480","192.168.0.37","192.168.0.44","UDP","103","7946  >  7946 Len=61"
"80","3.315283","192.168.0.44","192.168.0.37","UDP","93","7946  >  7946 Len=51"
"81","3.642145","Raspberr_83:fc:31","Broadcast","ARP","60","Who has 192.168.0.45? Tell 192.168.0.43"
"82","3.720141","192.168.0.44","192.168.0.45","TCP","74","[TCP Retransmission] [TCP Port numbers reused] 55394  >  6443 [SYN] Seq=0 Win=64240 Len=0 MSS=1460 SACK_PERM=1 TSval=2177921655 TSecr=0 WS=128"
"83","3.752080","192.168.0.44","192.168.0.45","TCP","74","[TCP Retransmission] [TCP Port numbers reused] 47994  >  7946 [SYN] Seq=0 Win=64240 Len=0 MSS=1460 SACK_PERM=1 TSval=2177921687 TSecr=0 WS=128"
"84","3.822115","192.168.0.44","192.168.0.42","UDP","103","7946  >  7946 Len=61"
"85","3.864767","192.168.0.42","192.168.0.44","UDP","93","7946  >  7946 Len=51"
"86","3.932806","Raspberr_ea:11:2e","Broadcast","ARP","60","Gratuitous ARP for 192.168.0.230 (Request)"
"87","3.932859","Raspberr_ea:11:2e","Broadcast","ARP","60","Gratuitous ARP for 192.168.0.230 (Reply)"
"88","3.944084","192.168.0.44","192.168.0.45","TCP","74","[TCP Retransmission] [TCP Port numbers reused] 55400  >  6443 [SYN] Seq=0 Win=64240 Len=0 MSS=1460 SACK_PERM=1 TSval=2177921879 TSecr=0 WS=128"
"89","4.102441","Raspberr_6c:c9:25","Broadcast","ARP","60","Who has 192.168.0.45? Tell 192.168.0.41"
"90","4.200916","192.168.0.44","192.168.0.45","TCP","74","55404  >  6443 [SYN] Seq=0 Win=64240 Len=0 MSS=1460 SACK_PERM=1 TSval=2177922135 TSecr=0 WS=128"
"91","4.274927","Raspberr_a8:2c:ee","Broadcast","ARP","60","Who has 192.168.0.45? Tell 192.168.0.42"
"92","4.282956","192.168.0.44","192.168.0.45","TCP","74","55408  >  6443 [SYN] Seq=0 Win=64240 Len=0 MSS=1460 SACK_PERM=1 TSval=2177922217 TSecr=0 WS=128"
"93","4.296068","192.168.0.44","192.168.0.45","TCP","74","[TCP Retransmission] [TCP Port numbers reused] 55374  >  6443 [SYN] Seq=0 Win=64240 Len=0 MSS=1460 SACK_PERM=1 TSval=2177922231 TSecr=0 WS=128"
"94","4.296097","192.168.0.44","192.168.0.45","TCP","74","[TCP Retransmission] [TCP Port numbers reused] 55378  >  6443 [SYN] Seq=0 Win=64240 Len=0 MSS=1460 SACK_PERM=1 TSval=2177922231 TSecr=0 WS=128"
"95","4.665566","Raspberr_83:fc:31","Broadcast","ARP","60","Who has 192.168.0.45? Tell 192.168.0.43"
"96","4.821497","192.168.0.44","192.168.0.37","UDP","103","7946  >  7946 Len=61"
"97","4.923000","192.168.0.37","192.168.0.44","UDP","93","7946  >  7946 Len=51"
"98","4.937200","192.168.0.44","192.168.0.45","TCP","74","55412  >  6443 [SYN] Seq=0 Win=64240 Len=0 MSS=1460 SACK_PERM=1 TSval=2177922872 TSecr=0 WS=128"
"99","4.962734","192.168.0.39","192.168.0.44","UDP","103","7946  >  7946 Len=61"
"100","4.984197","192.168.0.44","192.168.0.39","UDP","93","7946  >  7946 Len=51"
"101","5.033000","Raspberr_ea:11:2e","Broadcast","ARP","60","Gratuitous ARP for 192.168.0.230 (Request)"
"102","5.033042","Raspberr_ea:11:2e","Broadcast","ARP","60","Gratuitous ARP for 192.168.0.230 (Reply)"
"103","5.059291","Raspberr_c2:f4:69","Broadcast","ARP","60","Who has 192.168.0.45? Tell 192.168.0.40"
"104","5.064000","Raspberr_ea:11:2e","Raspberr_c2:f4:69","ARP","42","Who has 192.168.0.40? Tell 192.168.0.44"
"105","5.067575","Raspberr_c2:f4:69","Raspberr_ea:11:2e","ARP","60","192.168.0.40 is at b8:27:eb:c2:f4:69"
"106","5.124275","Raspberr_6c:c9:25","Broadcast","ARP","60","Who has 192.168.0.45? Tell 192.168.0.41"
"107","5.224114","192.168.0.44","192.168.0.45","TCP","74","[TCP Retransmission] [TCP Port numbers reused] 55404  >  6443 [SYN] Seq=0 Win=64240 Len=0 MSS=1460 SACK_PERM=1 TSval=2177923159 TSecr=0 WS=128"
"108","5.288102","192.168.0.44","192.168.0.45","TCP","74","[TCP Retransmission] [TCP Port numbers reused] 55408  >  6443 [SYN] Seq=0 Win=64240 Len=0 MSS=1460 SACK_PERM=1 TSval=2177923223 TSecr=0 WS=128"
"109","5.320101","192.168.0.44","192.168.0.45","TCP","66","23045  >  6443 [ACK] Seq=1 Ack=1 Win=3579 Len=0 TSval=2709775394 TSecr=3872525645"
"110","5.535065","192.168.0.45","192.168.0.44","TCP","74","7946  >  47728 [SYN, ACK] Seq=0 Ack=1 Win=65160 Len=0 MSS=1460 SACK_PERM=1 TSval=3872687700 TSecr=2177867959 WS=128"
"111","5.555329","192.168.0.44","192.168.0.45","TCP","54","47728  >  7946 [RST] Seq=1 Win=0 Len=0"
"112","5.682952","192.168.0.45","192.168.0.44","TCP","74","6443  >  55194 [SYN, ACK] Seq=0 Ack=1 Win=65160 Len=0 MSS=1460 SACK_PERM=1 TSval=3872687828 TSecr=2177868098 WS=128"
"113","5.683411","Raspberr_83:fc:31","Broadcast","ARP","60","Who has 192.168.0.45? Tell 192.168.0.43"
"114","5.703196","192.168.0.44","192.168.0.45","TCP","54","55194  >  6443 [RST] Seq=1 Win=0 Len=0"
"115","5.768102","192.168.0.44","192.168.0.45","TCP","74","[TCP Retransmission] [TCP Port numbers reused] 47994  >  7946 [SYN] Seq=0 Win=64240 Len=0 MSS=1460 SACK_PERM=1 TSval=2177923703 TSecr=0 WS=128"
"116","5.821648","192.168.0.44","192.168.0.40","UDP","108","7946  >  7946 Len=66"
"117","5.840829","192.168.0.40","192.168.0.44","UDP","93","7946  >  7946 Len=51"
"118","5.903263","192.168.0.45","192.168.0.44","TCP","74","6443  >  55138 [SYN, ACK] Seq=0 Ack=1 Win=65160 Len=0 MSS=1460 SACK_PERM=1 TSval=3872688255 TSecr=2177869495 WS=128"
"119","5.923526","192.168.0.44","192.168.0.45","TCP","54","55138  >  6443 [RST] Seq=1 Win=0 Len=0"
"120","5.960073","192.168.0.44","192.168.0.45","TCP","74","[TCP Retransmission] [TCP Port numbers reused] 55412  >  6443 [SYN] Seq=0 Win=64240 Len=0 MSS=1460 SACK_PERM=1 TSval=2177923895 TSecr=0 WS=128"
"121","5.960150","192.168.0.44","192.168.0.45","TCP","74","[TCP Retransmission] [TCP Port numbers reused] 55400  >  6443 [SYN] Seq=0 Win=64240 Len=0 MSS=1460 SACK_PERM=1 TSval=2177923895 TSecr=0 WS=128"
"122","6.088144","192.168.0.44","192.168.0.45","TCP","74","[TCP Retransmission] [TCP Port numbers reused] 55386  >  6443 [SYN] Seq=0 Win=64240 Len=0 MSS=1460 SACK_PERM=1 TSval=2177924023 TSecr=0 WS=128"
"123","6.088518","Raspberr_c2:f4:69","Broadcast","ARP","60","Who has 192.168.0.45? Tell 192.168.0.40"
"124","6.128400","192.168.0.42","192.168.0.44","UDP","103","7946  >  7946 Len=61"
"125","6.132456","Raspberr_ea:11:2e","Broadcast","ARP","60","Gratuitous ARP for 192.168.0.230 (Request)"
"126","6.132512","Raspberr_ea:11:2e","Broadcast","ARP","60","Gratuitous ARP for 192.168.0.230 (Reply)"
"127","6.145369","Raspberr_6c:c9:25","Broadcast","ARP","60","Who has 192.168.0.45? Tell 192.168.0.41"
"128","6.149580","192.168.0.44","192.168.0.42","UDP","93","7946  >  7946 Len=51"
"129","6.203594","192.168.0.44","192.168.0.45","TCP","74","55416  >  6443 [SYN] Seq=0 Win=64240 Len=0 MSS=1460 SACK_PERM=1 TSval=2177924138 TSecr=0 WS=128"
"130","6.496253","192.168.0.45","192.168.0.44","TCP","74","[TCP Previous segment not captured] [TCP Port numbers reused] 6443  >  55144 [SYN, ACK] Seq=0 Ack=1 Win=65160 Len=0 MSS=1460 SACK_PERM=1 TSval=3872689233 TSecr=2177870519 WS=128"
"131","6.496639","192.168.0.45","192.168.0.44","TCP","74","[TCP Retransmission] 6443  >  55138 [SYN, ACK] Seq=0 Ack=1 Win=65160 Len=0 MSS=1460 SACK_PERM=1 TSval=3872689268 TSecr=2177869495 WS=128"
"132","6.516472","192.168.0.44","192.168.0.45","TCP","54","55144  >  6443 [RST] Seq=1 Win=0 Len=0"
"133","6.516764","192.168.0.44","192.168.0.45","TCP","54","55138  >  6443 [RST] Seq=1 Win=0 Len=0"
"134","6.712426","192.168.0.45","192.168.0.44","TCP","66","6443  >  29818 [ACK] Seq=1 Ack=1 Win=9889 Len=0 TSval=3872689482 TSecr=2709568251"
"135","6.731871","192.168.0.45","192.168.0.44","TCP","66","6443  >  1047 [ACK] Seq=1 Ack=1 Win=501 Len=0 TSval=3872689482 TSecr=3905364080"
"136","6.735485","192.168.0.40","192.168.0.44","UDP","103","7946  >  7946 Len=61"
"137","6.756734","192.168.0.44","192.168.0.40","UDP","93","7946  >  7946 Len=51"
"138","6.762636","Raspberr_15:08:e7","Broadcast","ARP","60","Gratuitous ARP for 192.168.0.242 (Request)"
"139","6.821992","192.168.0.44","192.168.0.41","UDP","103","7946  >  7946 Len=61"
"140","6.846730","192.168.0.41","192.168.0.44","UDP","93","7946  >  7946 Len=51"
"141","7.114760","Raspberr_c2:f4:69","Broadcast","ARP","60","Who has 192.168.0.45? Tell 192.168.0.40"
"142","7.172493","Raspberr_6c:c9:25","Broadcast","ARP","60","Who has 192.168.0.45? Tell 192.168.0.41"
"143","7.201970","192.168.0.44","192.168.0.45","TCP","74","55426  >  6443 [SYN] Seq=0 Win=64240 Len=0 MSS=1460 SACK_PERM=1 TSval=2177925136 TSecr=0 WS=128"
"144","7.207766","192.168.0.44","192.168.0.45","TCP","74","55434  >  6443 [SYN] Seq=0 Win=64240 Len=0 MSS=1460 SACK_PERM=1 TSval=2177925142 TSecr=0 WS=128"
"145","7.208089","192.168.0.44","192.168.0.45","TCP","74","[TCP Retransmission] [TCP Port numbers reused] 55416  >  6443 [SYN] Seq=0 Win=64240 Len=0 MSS=1460 SACK_PERM=1 TSval=2177925143 TSecr=0 WS=128"
"146","7.208447","192.168.0.44","192.168.0.45","TCP","74","55436  >  6443 [SYN] Seq=0 Win=64240 Len=0 MSS=1460 SACK_PERM=1 TSval=2177925143 TSecr=0 WS=128"
"147","7.208909","192.168.0.44","192.168.0.45","TCP","74","55438  >  6443 [SYN] Seq=0 Win=64240 Len=0 MSS=1460 SACK_PERM=1 TSval=2177925143 TSecr=0 WS=128"
"148","7.209373","192.168.0.44","192.168.0.45","TCP","74","55440  >  6443 [SYN] Seq=0 Win=64240 Len=0 MSS=1460 SACK_PERM=1 TSval=2177925144 TSecr=0 WS=128"
"149","7.209784","192.168.0.44","192.168.0.45","TCP","74","55442  >  6443 [SYN] Seq=0 Win=64240 Len=0 MSS=1460 SACK_PERM=1 TSval=2177925144 TSecr=0 WS=128"
"150","7.210345","192.168.0.44","192.168.0.45","TCP","74","55444  >  6443 [SYN] Seq=0 Win=64240 Len=0 MSS=1460 SACK_PERM=1 TSval=2177925145 TSecr=0 WS=128"
"151","7.233298","Raspberr_ea:11:2e","Broadcast","ARP","60","Gratuitous ARP for 192.168.0.230 (Request)"
"152","7.233344","Raspberr_ea:11:2e","Broadcast","ARP","60","Gratuitous ARP for 192.168.0.230 (Reply)"
"153","7.240075","192.168.0.44","192.168.0.45","TCP","74","[TCP Retransmission] [TCP Port numbers reused] 55404  >  6443 [SYN] Seq=0 Win=64240 Len=0 MSS=1460 SACK_PERM=1 TSval=2177925175 TSecr=0 WS=128"
"154","7.294541","192.168.0.45","192.168.0.44","TCP","74","[TCP Previous segment not captured] [TCP Port numbers reused] 6443  >  55152 [SYN, ACK] Seq=0 Ack=1 Win=65160 Len=0 MSS=1460 SACK_PERM=1 TSval=3872690041 TSecr=2177871287 WS=128"
"155","7.304074","192.168.0.44","192.168.0.45","TCP","74","[TCP Retransmission] [TCP Port numbers reused] 55408  >  6443 [SYN] Seq=0 Win=64240 Len=0 MSS=1460 SACK_PERM=1 TSval=2177925239 TSecr=0 WS=128"
"156","7.314696","192.168.0.44","192.168.0.45","TCP","54","55152  >  6443 [RST] Seq=1 Win=0 Len=0"
"157","7.317962","192.168.0.45","192.168.0.44","TCP","74","[TCP Previous segment not captured] [TCP Port numbers reused] 6443  >  55148 [SYN, ACK] Seq=0 Ack=1 Win=65160 Len=0 MSS=1460 SACK_PERM=1 TSval=3872690041 TSecr=2177871287 WS=128"
"158","7.338075","192.168.0.44","192.168.0.45","TCP","54","55148  >  6443 [RST] Seq=1 Win=0 Len=0"
"159","7.644023","192.168.0.45","192.168.0.44","TCP","74","[TCP Port numbers reused] 6443  >  55204 [SYN, ACK] Seq=0 Ack=1 Win=65160 Len=0 MSS=1460 SACK_PERM=1 TSval=3872690833 TSecr=2177871097 WS=128"
"160","7.664236","192.168.0.44","192.168.0.45","TCP","54","55204  >  6443 [RST] Seq=1 Win=0 Len=0"
"161","7.671774","192.168.0.45","192.168.0.44","TCP","74","6443  >  55208 [SYN, ACK] Seq=0 Ack=1 Win=65160 Len=0 MSS=1460 SACK_PERM=1 TSval=3872690912 TSecr=2177872201 WS=128"
"162","7.691960","192.168.0.44","192.168.0.45","TCP","54","55208  >  6443 [RST] Seq=1 Win=0 Len=0"
"163","7.821972","192.168.0.44","192.168.0.39","UDP","103","7946  >  7946 Len=61"
"164","7.880048","192.168.0.44","192.168.0.45","TCP","74","[TCP Retransmission] [TCP Port numbers reused] 55394  >  6443 [SYN] Seq=0 Win=64240 Len=0 MSS=1460 SACK_PERM=1 TSval=2177925815 TSecr=0 WS=128"
"165","7.880093","192.168.0.44","192.168.0.45","TCP","74","21116  >  6443 [SYN] Seq=0 Win=64240 Len=0 MSS=1460 SACK_PERM=1 TSval=2709777954 TSecr=0 WS=128"
"166","7.911279","192.168.0.44","192.168.0.45","TCP","74","55448  >  6443 [SYN] Seq=0 Win=64240 Len=0 MSS=1460 SACK_PERM=1 TSval=2177925846 TSecr=0 WS=128"
"167","7.976121","192.168.0.44","192.168.0.45","TCP","74","[TCP Retransmission] [TCP Port numbers reused] 55412  >  6443 [SYN] Seq=0 Win=64240 Len=0 MSS=1460 SACK_PERM=1 TSval=2177925911 TSecr=0 WS=128"
"168","8.045539","192.168.0.45","192.168.0.44","TCP","74","[TCP Retransmission] 6443  >  55148 [SYN, ACK] Seq=0 Ack=1 Win=65160 Len=0 MSS=1460 SACK_PERM=1 TSval=3872691060 TSecr=2177871287 WS=128"
"169","8.045961","192.168.0.45","192.168.0.44","TCP","74","[TCP Retransmission] 6443  >  55204 [SYN, ACK] Seq=0 Ack=1 Win=65160 Len=0 MSS=1460 SACK_PERM=1 TSval=3872691860 TSecr=2177871097 WS=128"
"170","8.063474","192.168.0.45","192.168.0.44","TCP","74","[TCP Retransmission] 6443  >  55208 [SYN, ACK] Seq=0 Ack=1 Win=65160 Len=0 MSS=1460 SACK_PERM=1 TSval=3872691922 TSecr=2177872201 WS=128"
"171","8.066090","192.168.0.44","192.168.0.45","TCP","54","55204  >  6443 [RST] Seq=1 Win=0 Len=0"
"172","8.083671","192.168.0.44","192.168.0.45","TCP","54","55208  >  6443 [RST] Seq=1 Win=0 Len=0"
"173","8.090103","192.168.0.39","192.168.0.44","UDP","93","7946  >  7946 Len=51"
"174","8.133746","192.168.0.45","192.168.0.44","TCP","74","6443  >  55212 [SYN, ACK] Seq=0 Ack=1 Win=65160 Len=0 MSS=1460 SACK_PERM=1 TSval=3872692020 TSecr=2177873303 WS=128"
"175","8.139600","Raspberr_c2:f4:69","Broadcast","ARP","60","Who has 192.168.0.45? Tell 192.168.0.40"
"176","8.153975","192.168.0.44","192.168.0.45","TCP","54","55212  >  6443 [RST] Seq=1 Win=0 Len=0"
"177","8.159072","192.168.0.45","192.168.0.44","TCP","74","6443  >  55170 [SYN, ACK] Seq=0 Ack=1 Win=65160 Len=0 MSS=1460 SACK_PERM=1 TSval=3872692052 TSecr=2177872311 WS=128"
"178","8.179255","192.168.0.44","192.168.0.45","TCP","54","55170  >  6443 [RST] Seq=1 Win=0 Len=0"
"179","8.192477","Raspberr_6c:c9:25","Broadcast","ARP","60","Who has 192.168.0.45? Tell 192.168.0.41"
"180","8.232095","192.168.0.44","192.168.0.45","TCP","74","[TCP Retransmission] [TCP Port numbers reused] 55444  >  6443 [SYN] Seq=0 Win=64240 Len=0 MSS=1460 SACK_PERM=1 TSval=2177926167 TSecr=0 WS=128"
"181","8.232143","192.168.0.44","192.168.0.45","TCP","74","[TCP Retransmission] [TCP Port numbers reused] 55426  >  6443 [SYN] Seq=0 Win=64240 Len=0 MSS=1460 SACK_PERM=1 TSval=2177926167 TSecr=0 WS=128"
"182","8.232161","192.168.0.44","192.168.0.45","TCP","74","[TCP Retransmission] [TCP Port numbers reused] 55442  >  6443 [SYN] Seq=0 Win=64240 Len=0 MSS=1460 SACK_PERM=1 TSval=2177926167 TSecr=0 WS=128"
"183","8.232226","192.168.0.44","192.168.0.45","TCP","74","[TCP Retransmission] [TCP Port numbers reused] 55438  >  6443 [SYN] Seq=0 Win=64240 Len=0 MSS=1460 SACK_PERM=1 TSval=2177926167 TSecr=0 WS=128"
"184","8.232270","192.168.0.44","192.168.0.45","TCP","74","[TCP Retransmission] [TCP Port numbers reused] 55436  >  6443 [SYN] Seq=0 Win=64240 Len=0 MSS=1460 SACK_PERM=1 TSval=2177926167 TSecr=0 WS=128"
"185","8.232325","192.168.0.44","192.168.0.45","TCP","74","[TCP Retransmission] [TCP Port numbers reused] 55434  >  6443 [SYN] Seq=0 Win=64240 Len=0 MSS=1460 SACK_PERM=1 TSval=2177926167 TSecr=0 WS=128"
"186","8.328778","192.168.0.45","192.168.0.44","TCP","74","[TCP Retransmission] 6443  >  55144 [SYN, ACK] Seq=0 Ack=1 Win=65160 Len=0 MSS=1460 SACK_PERM=1 TSval=3872692276 TSecr=2177870519 WS=128"
"187","8.332657","Raspberr_ea:11:2e","Broadcast","ARP","60","Gratuitous ARP for 192.168.0.230 (Request)"
"188","8.332695","Raspberr_ea:11:2e","Broadcast","ARP","60","Gratuitous ARP for 192.168.0.230 (Reply)"
"189","8.348989","192.168.0.44","192.168.0.45","TCP","54","55144  >  6443 [RST] Seq=1 Win=0 Len=0"
"190","8.732497","Raspberr_15:08:e7","Broadcast","ARP","60","Gratuitous ARP for 192.168.0.242 (Request)"
"191","8.805731","192.168.0.44","192.168.0.45","TCP","74","55452  >  6443 [SYN] Seq=0 Win=64240 Len=0 MSS=1460 SACK_PERM=1 TSval=2177926740 TSecr=0 WS=128"
"192","8.821832","192.168.0.44","192.168.0.43","UDP","103","7946  >  7946 Len=61"
"193","8.845960","192.168.0.43","192.168.0.44","UDP","93","7946  >  7946 Len=51"
"194","8.846269","192.168.0.45","192.168.0.44","TCP","74","[TCP Retransmission] 6443  >  55208 [SYN, ACK] Seq=0 Ack=1 Win=65160 Len=0 MSS=1460 SACK_PERM=1 TSval=3872692948 TSecr=2177872201 WS=128"
"195","8.866469","192.168.0.44","192.168.0.45","TCP","54","55208  >  6443 [RST] Seq=1 Win=0 Len=0"
"196","8.936061","192.168.0.44","192.168.0.45","TCP","74","[TCP Retransmission] [TCP Port numbers reused] 55448  >  6443 [SYN] Seq=0 Win=64240 Len=0 MSS=1460 SACK_PERM=1 TSval=2177926871 TSecr=0 WS=128"
"197","8.954008","192.168.0.45","192.168.0.44","TCP","74","[TCP Retransmission] 6443  >  55212 [SYN, ACK] Seq=0 Ack=1 Win=65160 Len=0 MSS=1460 SACK_PERM=1 TSval=3872693044 TSecr=2177873303 WS=128"
"198","8.974141","192.168.0.44","192.168.0.45","TCP","54","55212  >  6443 [RST] Seq=1 Win=0 Len=0"
"199","9.224074","192.168.0.44","192.168.0.45","TCP","74","[TCP Retransmission] [TCP Port numbers reused] 55416  >  6443 [SYN] Seq=0 Win=64240 Len=0 MSS=1460 SACK_PERM=1 TSval=2177927159 TSecr=0 WS=128"
"200","9.284495","Raspberr_15:08:e7","Broadcast","ARP","60","Gratuitous ARP for 192.168.0.242 (Request)"
"201","9.421491","192.168.0.45","192.168.0.44","TCP","74","[TCP Retransmission] 6443  >  55170 [SYN, ACK] Seq=0 Ack=1 Win=65160 Len=0 MSS=1460 SACK_PERM=1 TSval=3872694068 TSecr=2177872311 WS=128"
"202","9.432853","Raspberr_ea:11:2e","Broadcast","ARP","60","Gratuitous ARP for 192.168.0.230 (Request)"
"203","9.432877","Raspberr_ea:11:2e","Broadcast","ARP","60","Gratuitous ARP for 192.168.0.230 (Reply)"
"204","9.441619","192.168.0.44","192.168.0.45","TCP","54","55170  >  6443 [RST] Seq=1 Win=0 Len=0"
"205","9.652183","192.168.0.41","192.168.0.44","UDP","103","7946  >  7946 Len=61"
"206","9.673158","192.168.0.44","192.168.0.41","UDP","93","7946  >  7946 Len=51"
"207","9.688821","192.168.0.40","192.168.0.44","UDP","103","7946  >  7946 Len=61"
"208","9.709799","192.168.0.44","192.168.0.40","UDP","93","7946  >  7946 Len=51"
"209","9.821343","192.168.0.44","192.168.0.40","UDP","108","7946  >  7946 Len=66"
"210","9.832017","192.168.0.44","192.168.0.45","TCP","74","[TCP Retransmission] [TCP Port numbers reused] 55452  >  6443 [SYN] Seq=0 Win=64240 Len=0 MSS=1460 SACK_PERM=1 TSval=2177927767 TSecr=0 WS=128"
"211","9.885445","192.168.0.45","192.168.0.44","TLSv1.2","103","Application Data"
"212","9.890130","192.168.0.40","192.168.0.44","UDP","93","7946  >  7946 Len=51"
"213","9.905610","192.168.0.44","192.168.0.45","TCP","66","10250  >  42910 [ACK] Seq=1 Ack=38 Win=903 Len=0 TSval=2177927840 TSecr=3812006204"
"214","9.908324","192.168.0.44","192.168.0.45","TCP","74","55464  >  6443 [SYN] Seq=0 Win=64240 Len=0 MSS=1460 SACK_PERM=1 TSval=2177927843 TSecr=0 WS=128"
"215","9.928031","192.168.0.44","192.168.0.45","TCP","74","[TCP Retransmission] [TCP Port numbers reused] 47994  >  7946 [SYN] Seq=0 Win=64240 Len=0 MSS=1460 SACK_PERM=1 TSval=2177927863 TSecr=0 WS=128"
"216","9.998977","192.168.0.45","192.168.0.44","TCP","74","6443  >  55198 [SYN, ACK] Seq=0 Ack=1 Win=65160 Len=0 MSS=1460 SACK_PERM=1 TSval=3872694610 TSecr=2177875895 WS=128"
"217","10.019110","192.168.0.44","192.168.0.45","TCP","54","55198  >  6443 [RST] Seq=1 Win=0 Len=0"
"218","10.184073","192.168.0.44","192.168.0.45","TCP","74","[TCP Retransmission] [TCP Port numbers reused] 55400  >  6443 [SYN] Seq=0 Win=64240 Len=0 MSS=1460 SACK_PERM=1 TSval=2177928119 TSecr=0 WS=128"
"219","10.184302","Raspberr_c2:f4:69","Broadcast","ARP","60","Who has 192.168.0.45? Tell 192.168.0.40"
"220","10.228653","192.168.0.45","192.168.0.44","TCP","74","6443  >  55250 [SYN, ACK] Seq=0 Ack=1 Win=65160 Len=0 MSS=1460 SACK_PERM=1 TSval=3872694864 TSecr=2177875138 WS=128"
"221","10.248054","192.168.0.44","192.168.0.45","TCP","74","[TCP Retransmission] [TCP Port numbers reused] 55434  >  6443 [SYN] Seq=0 Win=64240 Len=0 MSS=1460 SACK_PERM=1 TSval=2177928183 TSecr=0 WS=128"
"222","10.248083","192.168.0.44","192.168.0.45","TCP","74","[TCP Retransmission] [TCP Port numbers reused] 55426  >  6443 [SYN] Seq=0 Win=64240 Len=0 MSS=1460 SACK_PERM=1 TSval=2177928183 TSecr=0 WS=128"
"223","10.248094","192.168.0.44","192.168.0.45","TCP","74","[TCP Retransmission] [TCP Port numbers reused] 55436  >  6443 [SYN] Seq=0 Win=64240 Len=0 MSS=1460 SACK_PERM=1 TSval=2177928183 TSecr=0 WS=128"
"224","10.248109","192.168.0.44","192.168.0.45","TCP","74","[TCP Retransmission] [TCP Port numbers reused] 55438  >  6443 [SYN] Seq=0 Win=64240 Len=0 MSS=1460 SACK_PERM=1 TSval=2177928183 TSecr=0 WS=128"
"225","10.248137","192.168.0.44","192.168.0.45","TCP","74","[TCP Retransmission] [TCP Port numbers reused] 55440  >  6443 [SYN] Seq=0 Win=64240 Len=0 MSS=1460 SACK_PERM=1 TSval=2177928183 TSecr=0 WS=128"
"226","10.248173","192.168.0.44","192.168.0.45","TCP","74","[TCP Retransmission] [TCP Port numbers reused] 55442  >  6443 [SYN] Seq=0 Win=64240 Len=0 MSS=1460 SACK_PERM=1 TSval=2177928183 TSecr=0 WS=128"
"227","10.248210","192.168.0.44","192.168.0.45","TCP","74","[TCP Retransmission] [TCP Port numbers reused] 55444  >  6443 [SYN] Seq=0 Win=64240 Len=0 MSS=1460 SACK_PERM=1 TSval=2177928183 TSecr=0 WS=128"
"228","10.248749","192.168.0.44","192.168.0.45","TCP","54","55250  >  6443 [RST] Seq=1 Win=0 Len=0"
"229","10.296508","192.168.0.45","192.168.0.44","TCP","74","[TCP Retransmission] 6443  >  55208 [SYN, ACK] Seq=0 Ack=1 Win=65160 Len=0 MSS=1460 SACK_PERM=1 TSval=3872694968 TSecr=2177872201 WS=128"
"230","10.296859","192.168.0.37","192.168.0.44","UDP","103","7946  >  7946 Len=61"
"231","10.309967","Raspberr_15:08:e7","Broadcast","ARP","60","Gratuitous ARP for 192.168.0.242 (Request)"
"232","10.316621","192.168.0.44","192.168.0.45","TCP","54","55208  >  6443 [RST] Seq=1 Win=0 Len=0"
"233","10.317875","192.168.0.44","192.168.0.37","UDP","93","7946  >  7946 Len=51"
"234","10.457922","Raspberr_15:08:e7","Broadcast","ARP","60","Gratuitous ARP for 192.168.0.242 (Reply)"
"235","10.458138","192.168.0.45","192.168.0.44","TCP","74","[TCP Retransmission] 6443  >  55212 [SYN, ACK] Seq=0 Ack=1 Win=65160 Len=0 MSS=1460 SACK_PERM=1 TSval=3872695057 TSecr=2177873303 WS=128"
"236","10.478283","192.168.0.44","192.168.0.45","TCP","54","55212  >  6443 [RST] Seq=1 Win=0 Len=0"
"237","10.532701","Raspberr_ea:11:2e","Broadcast","ARP","60","Gratuitous ARP for 192.168.0.230 (Request)"
"238","10.532740","Raspberr_ea:11:2e","Broadcast","ARP","60","Gratuitous ARP for 192.168.0.230 (Reply)"
"239","10.623739","192.168.0.45","192.168.0.44","TCP","74","[TCP Retransmission] 6443  >  55144 [SYN, ACK] Seq=0 Ack=1 Win=65160 Len=0 MSS=1460 SACK_PERM=1 TSval=3872696340 TSecr=2177870519 WS=128"
"240","10.637382","192.168.0.45","192.168.0.44","TCP","74","[TCP Retransmission] 6443  >  55212 [SYN, ACK] Seq=0 Ack=1 Win=65160 Len=0 MSS=1460 SACK_PERM=1 TSval=3872697076 TSecr=2177873303 WS=128"
"241","10.643889","192.168.0.44","192.168.0.45","TCP","54","55144  >  6443 [RST] Seq=1 Win=0 Len=0"
"242","10.657465","192.168.0.44","192.168.0.45","TCP","54","55212  >  6443 [RST] Seq=1 Win=0 Len=0"
"243","10.674727","192.168.0.41","192.168.0.44","UDP","103","7946  >  7946 Len=61"
"244","10.676279","Raspberr_15:08:e7","Broadcast","ARP","60","Gratuitous ARP for 192.168.0.242 (Request)"
"245","10.695821","192.168.0.44","192.168.0.41","UDP","93","7946  >  7946 Len=51"
"246","10.734550","Raspberr_15:08:e7","Broadcast","ARP","60","Who has 192.168.0.1? Tell 192.168.0.45"
"247","10.821820","192.168.0.44","192.168.0.42","UDP","103","7946  >  7946 Len=61"
"248","10.860455","192.168.0.42","192.168.0.44","UDP","93","7946  >  7946 Len=51"
"249","10.920045","192.168.0.44","192.168.0.45","TCP","74","[TCP Retransmission] [TCP Port numbers reused] 55464  >  6443 [SYN] Seq=0 Win=64240 Len=0 MSS=1460 SACK_PERM=1 TSval=2177928855 TSecr=0 WS=128"
"250","10.949343","Raspberr_c2:f4:69","Raspberr_ea:11:2e","ARP","60","Who has 192.168.0.44? Tell 192.168.0.40"
"251","10.957584","192.168.0.39","192.168.0.44","UDP","103","7946  >  7946 Len=61"
"252","10.969419","Raspberr_ea:11:2e","Raspberr_c2:f4:69","ARP","42","192.168.0.44 is at b8:27:eb:ea:11:2e"
"253","10.979719","192.168.0.44","192.168.0.39","UDP","93","7946  >  7946 Len=51"
"254","11.132024","192.168.0.42","192.168.0.44","UDP","103","7946  >  7946 Len=61"
"255","11.153073","192.168.0.44","192.168.0.42","UDP","93","7946  >  7946 Len=51"
"256","11.211006","Raspberr_c2:f4:69","Broadcast","ARP","60","Who has 192.168.0.45? Tell 192.168.0.40"
"257","11.370443","192.168.0.45","192.168.0.44","TCP","74","[TCP Retransmission] 6443  >  55198 [SYN, ACK] Seq=0 Ack=1 Win=65160 Len=0 MSS=1460 SACK_PERM=1 TSval=3872697652 TSecr=2177875895 WS=128"
"258","11.390592","192.168.0.44","192.168.0.45","TCP","54","55198  >  6443 [RST] Seq=1 Win=0 Len=0"
"259","11.405293","192.168.0.45","192.168.0.44","TCP","74","6443  >  55272 [SYN, ACK] Seq=0 Ack=1 Win=65160 Len=0 MSS=1460 SACK_PERM=1 TSval=3872697653 TSecr=2177878935 WS=128"
"260","11.425433","192.168.0.44","192.168.0.45","TCP","54","55272  >  6443 [RST] Seq=1 Win=0 Len=0"
"261","11.464080","192.168.0.44","192.168.0.45","TCP","74","[TCP Retransmission] [TCP Port numbers reused] 55404  >  6443 [SYN] Seq=0 Win=64240 Len=0 MSS=1460 SACK_PERM=1 TSval=2177929399 TSecr=0 WS=128"
"262","11.464122","192.168.0.44","192.168.0.45","TCP","74","[TCP Retransmission] [TCP Port numbers reused] 55408  >  6443 [SYN] Seq=0 Win=64240 Len=0 MSS=1460 SACK_PERM=1 TSval=2177929399 TSecr=0 WS=128"
"263","11.467666","192.168.0.45","192.168.0.44","TCP","66","6443  >  40976 [ACK] Seq=1 Ack=1 Win=6153 Len=0 TSval=3872697687 TSecr=2177633941"
"264","11.632278","Raspberr_ea:11:2e","Broadcast","ARP","60","Gratuitous ARP for 192.168.0.230 (Request)"
"265","11.632313","Raspberr_ea:11:2e","Broadcast","ARP","60","Gratuitous ARP for 192.168.0.230 (Reply)"
"266","11.672107","192.168.0.45","192.168.0.44","TCP","74","[TCP Retransmission] 6443  >  55250 [SYN, ACK] Seq=0 Ack=1 Win=65160 Len=0 MSS=1460 SACK_PERM=1 TSval=3872697908 TSecr=2177875138 WS=128"
"267","11.692255","192.168.0.44","192.168.0.45","TCP","54","55250  >  6443 [RST] Seq=1 Win=0 Len=0"
"268","11.821470","192.168.0.44","192.168.0.39","UDP","103","7946  >  7946 Len=61"
"269","11.836249","192.168.0.45","192.168.0.44","TCP","74","6443  >  55246 [SYN, ACK] Seq=0 Ack=1 Win=65160 Len=0 MSS=1460 SACK_PERM=1 TSval=3872698004 TSecr=2177878167 WS=128"
"270","11.838250","192.168.0.45","192.168.0.44","TCP","74","6443  >  55244 [SYN, ACK] Seq=0 Ack=1 Win=65160 Len=0 MSS=1460 SACK_PERM=1 TSval=3872698004 TSecr=2177878167 WS=128"
"271","11.839524","192.168.0.45","192.168.0.44","TCP","74","6443  >  55260 [SYN, ACK] Seq=0 Ack=1 Win=65160 Len=0 MSS=1460 SACK_PERM=1 TSval=3872698004 TSecr=2177878167 WS=128"
"272","11.839688","192.168.0.45","192.168.0.44","TCP","74","[TCP Previous segment not captured] [TCP Port numbers reused] 6443  >  55204 [SYN, ACK] Seq=0 Ack=1 Win=65160 Len=0 MSS=1460 SACK_PERM=1 TSval=3872698036 TSecr=2177878199 WS=128"
"273","11.845567","192.168.0.37","192.168.0.44","UDP","129","7946  >  7946 Len=87"
"274","11.848034","192.168.0.44","192.168.0.45","TCP","74","[TCP Retransmission] [TCP Port numbers reused] 55452  >  6443 [SYN] Seq=0 Win=64240 Len=0 MSS=1460 SACK_PERM=1 TSval=2177929783 TSecr=0 WS=128"
"275","11.856346","192.168.0.44","192.168.0.45","TCP","54","55246  >  6443 [RST] Seq=1 Win=0 Len=0"
"276","11.858304","192.168.0.44","192.168.0.45","TCP","54","55244  >  6443 [RST] Seq=1 Win=0 Len=0"
"277","11.859581","192.168.0.44","192.168.0.45","TCP","54","55260  >  6443 [RST] Seq=1 Win=0 Len=0"
"278","11.859745","192.168.0.44","192.168.0.45","TCP","54","55204  >  6443 [RST] Seq=1 Win=0 Len=0"
"279","11.866317","192.168.0.44","192.168.0.42","UDP","103","7946  >  7946 Len=61"
"280","12.086199","192.168.0.45","192.168.0.44","TCP","74","[TCP Retransmission] 6443  >  55208 [SYN, ACK] Seq=0 Ack=1 Win=65160 Len=0 MSS=1460 SACK_PERM=1 TSval=3872698192 TSecr=2177872201 WS=128"
"281","12.086450","Raspberr_15:08:e7","Broadcast","ARP","60","Who has 192.168.0.1? Tell 192.168.0.45"
"282","12.086615","192.168.0.39","192.168.0.44","UDP","93","7946  >  7946 Len=51"
"283","12.091976","Raspberr_15:08:e7","Broadcast","ARP","60","Gratuitous ARP for 192.168.0.242 (Request)"
"284","12.092939","Raspberr_15:08:e7","Broadcast","ARP","60","Gratuitous ARP for 192.168.0.242 (Reply)"
"285","12.106350","192.168.0.44","192.168.0.45","TCP","54","55208  >  6443 [RST] Seq=1 Win=0 Len=0"
"286","12.177910","192.168.0.42","192.168.0.44","UDP","93","7946  >  7946 Len=51"
"287","12.198856","192.168.0.44","192.168.0.37","UDP","93","7946  >  7946 Len=51"
"288","12.232072","192.168.0.44","192.168.0.45","TCP","74","[TCP Retransmission] [TCP Port numbers reused] 55412  >  6443 [SYN] Seq=0 Win=64240 Len=0 MSS=1460 SACK_PERM=1 TSval=2177930167 TSecr=0 WS=128"
"289","12.415689","192.168.0.45","192.168.0.44","TCP","74","[TCP Retransmission] 6443  >  55272 [SYN, ACK] Seq=0 Ack=1 Win=65160 Len=0 MSS=1460 SACK_PERM=1 TSval=3872698676 TSecr=2177878935 WS=128"
"290","12.435844","192.168.0.44","192.168.0.45","TCP","54","55272  >  6443 [RST] Seq=1 Win=0 Len=0"
"291","12.488040","192.168.0.44","192.168.0.45","TCP","78","27196  >  6443 [ACK] Seq=1 Ack=1 Win=4029 Len=0 TSval=2709782562 TSecr=3872430612 SLE=1449 SRE=4345"
"292","12.556225","Raspberr_3e:aa:fc","Broadcast","ARP","60","Who has 192.168.0.45? Tell 192.168.0.37"
"293","12.572964","192.168.0.45","192.168.0.44","UDP","198","7946  >  7946 Len=156"
"294","12.621008","192.168.0.44","192.168.0.39","UDP","141","7946  >  7946 Len=99"
"295","12.621213","192.168.0.44","192.168.0.40","UDP","141","7946  >  7946 Len=99"
"296","12.621477","192.168.0.44","192.168.0.37","UDP","141","7946  >  7946 Len=99"
"297","12.707384","192.168.0.40","192.168.0.44","UDP","141","7946  >  7946 Len=99"
"298","12.732115","Raspberr_ea:11:2e","Broadcast","ARP","60","Gratuitous ARP for 192.168.0.230 (Request)"
"299","12.732147","Raspberr_ea:11:2e","Broadcast","ARP","60","Gratuitous ARP for 192.168.0.230 (Reply)"
"300","12.752531","192.168.0.43","192.168.0.44","UDP","141","7946  >  7946 Len=99"
"301","12.821624","192.168.0.44","192.168.0.41","UDP","103","7946  >  7946 Len=61"
"302","12.821683","192.168.0.44","192.168.0.40","UDP","141","7946  >  7946 Len=99"
"303","12.889485","fe80::1a3d:92ce:6af5:2aa1","ff02::1","ICMPv6","86","Neighbor Advertisement fd6c:dfdf:13b5:4edf:b204:5fb4:3e73:b5c7 (rtr, ovr) is at e4:5f:01:15:08:e7"
